{"$schema":"https://json-schema.org/draft/2020-12/schema","type":"object","additionalProperties":false,"required":["decision","reason_codes","evidence_artifact_ids","evaluated_at","code_revision","content_hash"],"properties":{"decision":{"enum":["PASS","FAIL"]},"reason_codes":{"type":"array","items":{"type":"string"}},"evidence_artifact_ids":{"type":"array","minItems":1,"items":{"type":"string"}},"evaluated_at":{"type":"string","format":"date-time"},"code_revision":{"type":"string","minLength":1},"content_hash":{"type":"string","pattern":"^[0-9a-f]{64}$"}}}
