{
  "decision": "PASS",
  "reason_codes": [],
  "evidence_artifact_ids": [
    "evidence:ama_100_economic_semantics_verified",
    "evidence:ama_101_semantic_remediation_verified",
    "evidence:covariance_psd_and_stability_verified",
    "evidence:equity_pricing_baseline_scope_and_asset_applicability_verified",
    "evidence:expected_return_components_and_per_share_growth_reconciled",
    "evidence:factor_specific_risk_decomposition_and_floor_verified",
    "evidence:mandate_benchmark_risk_authority_pre_registered",
    "evidence:model_scope_and_calculation_lineage_complete",
    "evidence:non_equity_forecasts_independent_of_pricing_baseline_verified",
    "evidence:numeric_currency_horizon_unit_formula_context_complete",
    "evidence:return_semantic_types_separated",
    "evidence:risk_free_currency_horizon_compounding_verified",
    "evidence:uncertainty_shrinkage_abstain_and_no_double_confidence_verified",
    "evidence:var_cvar_fx_liquidity_stress_reproducible",
    "evidence:variance_contributions_reconcile",
    "evidence:volatility_contributions_reconcile"
  ],
  "evaluated_at": "2026-09-08T00:00:00+00:00",
  "code_revision": "gate-d2@1",
  "content_hash": "af60b5ad491fbe8c95a0758ba3ff3b83044b9b2b1f41d01b6016d77545e2aa7f"
}
